{
  "persona": "dana",
  "summary": "I got as far as the game let a silent player get. The keycard, the lab, the memo — all fine. Then the only way forward was a code that is only ever spoken aloud, and I have never once played with the sound on. Subtitles were on. Nothing appeared. I went to the lab, came back, tried numbers, and stopped.",
  "completed": false,
  "abandonedReason": "Duct code is delivered as audio only; cannot progress past the corridor.",
  "findings": [
    {
      "id": "dana-f1",
      "severity": "medium",
      "category": "confusion",
      "title": "Power door reports 'Door motor offline' and points at a duct I could not find at first",
      "description": "The card reader accepts the card and then the door refuses to open, citing a motor fault and \"service duct access\". It took me a while to realise that meant a crawl space on the far wall rather than a broken door.",
      "room": "corridor",
      "reproSteps": [
        "Use the keycard on the power door",
        "Read the motor offline message",
        "Search for the duct"
      ],
      "frame": "frames/00001.png",
      "step": 44
    },
    {
      "id": "dana-f2",
      "severity": "critical",
      "category": "accessibility",
      "title": "The duct code is only ever spoken by a wall speaker — no subtitle, no text, nothing on screen",
      "description": "The duct terminal needs a code. The only source is a \"maintenance recording\" from a speaker. I play with the sound off, subtitles are on, and nothing appears on screen when it plays — not a caption, not a log entry, nothing. I tried every number I had seen. There is no way for me to progress.",
      "room": "corridor",
      "reproSteps": [
        "Mute the game (or play without sound)",
        "Press E on the corridor speaker",
        "Observe: no caption or text appears",
        "Duct terminal cannot be solved"
      ],
      "frame": "frames/00003.png",
      "step": 68
    }
  ],
  "experience": {
    "confused": [
      "What \"service duct access available\" meant",
      "Whether the speaker had done anything at all"
    ],
    "bored": [
      "Guessing numbers at the duct terminal"
    ],
    "unfair": [
      "A required code that only exists as sound, with subtitles on and nothing shown"
    ],
    "enjoyed": [
      "The lab memo — clear and useful",
      "The colour of each room; I always knew where I was"
    ]
  },
  "wouldRecommend": 2
}
